{
  "window": {
    "timezone": "America/Chicago",
    "start_local": "2026-03-13T00:00:00-05:00",
    "end_local": "2026-03-13T23:59:59-05:00"
  },
  "run_date": "2026-03-13",
  "companies": [
    {
      "sales_team_size_estimate": null,
      "exclusion_flags": [],
      "reason": "Domain presents a single-operator B2B revenue operator profile with clear ownership and direct contact path; qualifies for SMB CEO/founder decision-maker targeting.",
      "signals": [
        "Multi-offer positioning across RevOps/BD/Sales Ops",
        "Execution-first pipeline language and KPI framing",
        "B2B role targeting indicates complex sales motion familiarity"
      ],
      "likely_revops_need": "medium",
      "company": "TonyBeal.net",
      "employee_estimate": 1,
      "revops_need_score": 68,
      "revenue_estimate": null,
      "sources": [
        "https://www.tonybeal.net/",
        "https://www.tonybeal.net/resume.html"
      ],
      "website": "https://www.tonybeal.net/",
      "decision_maker_hints": [
        "Founder",
        "CEO",
        "RevOps leader"
      ],
      "industry": "Revenue Operations / Business Development"
    }
  ],
  "counts": {
    "input_candidates": 1,
    "excluded_companies": 0,
    "qualified_companies": 1
  },
  "notes": {
    "quality_flags": [
      "SMB_SINGLE_OPERATOR_CONTEXT"
    ],
    "blockers": []
  }
}
